{"schema_version":"search-paper-ids-v1","block":145,"start":37120,"paper_ids":["cb9a9fb32f359f80a6c8f07cd90c222ce291b05f","2d543c540b842a48edc1bd4fc21e0f3d099ad7c4","6329727f0a2d6ec05050eb3f83f3c1698aa6cb37","86a718216a160551ef3f7bdc62e83b89882d3b7e","89d594d364223d03e41a36e079f46595a56dd184","68326719a2ad8f0e951b2ae4291e98988fcf11aa","bf3632fc2d70636c47e00c6610e4885a01c541f2","144e275e8b01cdae91e7e9dc35697d342e130ac4","8db7aa0db095ca96dbbaa99e6f35713e150e0e2e","17baecb12feed2ec09feac8d74416e39d8fc0a34","d13c8e3e1a1a666ca826c0df231587e53f982270","03541413f9c1a42f5a5d0ab5ee851c804ae5240f","3adfd106f3fd6a8dc41d9a11b528b88b647e33ad","7bc1e0f93a5dc5d2f29038b0b5290c0d0c93471a","076e7cdec0f99a413e66f46091589c4509e552ba","cc392aa3560270f771459f576a4c6586ea911998","a3e053504b3b2007012723a73dae6553c6cee490","e670c6d358de28722f255ea1192c9e01a0a83ee7","6a5037aa2a99c836257f1574bfc5f13eb168e0fa","020ddc23db0cf95ed523695f5001022c1cd1a9a0","8c53374b1af266cadd20c533e6a1741676389f1a","1382287d4170351cb0706e3c7408743d0404ea33","fb1430b9d3b2c3dcf51a6f019fbeadda55e334be","85f5e21f87f8700c13594c04789939c85da5d090","4b677d8818b73538540ccaf60a6986ddaa390313","89f0d27430ce2cb8861ab7625e38c7497393ce65","e9f91b0fff5bf3f077a6a5e2909dbe84f2bd30c6","9f16eec65000f1ab28ebb0489190b01692b205cf"]}
